Cochrane Review ID,Author(s),Title,Source,Year,Abstract,Issue,Publisher,ISSN,Keywords,DOI,URL,Cochrane Review Group Code
CD009405.PUB2,"Horvat, L; Horey, D; Romios, P; Kis‐Rigo, J",Cultural competence education for health professionals,Cochrane Database of Systematic Reviews,2014,"Abstract - Background Cultural competence education for health professionals aims to ensure all people receive equitable, effective health care, particularly those from culturally and linguistically diverse (CALD) backgrounds. It has emerged as a strategy in high‐income English‐speaking countries in response to evidence of health disparities, structural inequalities, and poorer quality health care and outcomes among people from minority CALD backgrounds. However there is a paucity of evidence to link cultural competence education with patient, professional and organisational outcomes. To assess efficacy, for this review we developed a four‐dimensional conceptual framework comprising educational content, pedagogical approach, structure of the intervention, and participant characteristics to provide consistency in describing and assessing interventions. We use the term 'CALD participants' when referring to minority CALD populations as a whole. When referring to participants in included studies we describe them in terms used by study authors. Objectives To assess the effects of cultural competence education interventions for health professionals on patient‐related outcomes, health professional outcomes, and healthcare organisation outcomes. Search methods We searched: MEDLINE (OvidSP) (1946 to June 2012); Cochrane Central Register of Controlled Trials (CENTRAL,  The Cochrane Library ) (June 2012); EMBASE (OvidSP) (1988 to June 2012); CINAHL (EbscoHOST) (1981 to June 2012); PsycINFO (OvidSP) (1806 to June 2012); Proquest Dissertations and Theses database (1861 to October 2011); ERIC (CSA) (1966 to October 2011); LILACS (1982 to March 2012); and Current Contents (OvidSP) (1993 Week 27 to June 2012). Searches in MEDLINE, CENTRAL, PsycINFO, EMBASE, Proquest Dissertations and Theses, ERIC and Current Contents were updated in February 2014. Searches in CINAHL were updated in March 2014. There were no language restrictions. Selection criteria We included randomised controlled trials (RCTs), cluster RCTs, and controlled clinical trials of educational interventions for health professionals working in health settings that aimed to improve: health outcomes of patients/consumers of minority cultural and linguistic backgrounds; knowledge, skills and attitudes of health professionals in delivering culturally competent care; and healthcare organisation performance in culturally competent care. Data collection and analysis We used the conceptual framework as the basis for data extraction. Two review authors independently extracted data on interventions, methods, and outcome measures and mapped them against the framework. Additional information was sought from study authors. We present results in narrative and tabular form. Main results We included five RCTs involving 337 healthcare professionals and 8400 patients; at least 3463 (41%) were from CALD backgrounds. Trials compared the effects of cultural competence training for health professionals, with no training. Three studies were from the USA, one from Canada and one from The Netherlands. They involved health professionals of diverse backgrounds, although most were not from CALD minorities. Cultural background was determined using a validated scale (one study), self‐report (two studies) or not reported (two studies). The design effect from clustering meant an effective minimum sample size of 3164 CALD participants. No meta‐analyses were performed. The quality of evidence for each outcome was judged to be low. Two trials comparing cultural competence training with no training found no evidence of effect for treatment outcomes, including the proportion of patients with diabetes achieving LDL cholesterol control targets (risk difference (RD) ‐0.02, 95% CI ‐0.06 to 0.02; 1 study, USA, 2699 ""black"" patients, moderate quality), or change in weight loss (standardised mean difference (SMD) 0.07, 95% CI ‐0.41 to 0.55, 1 study, USA, effective sample size (ESS) 68 patients, low quality). Health behaviour (client concordance with attendance) improved significantly among intervention participants compared with controls (relative risk (RR) 1.53, 95% CI 1.03 to 2.27, 1 study, USA, ESS 28 women, low quality). Involvement in care by ""non‐Western"" patients (described as ""mainly Turkish, Moroccan, Cape Verdean and Surinamese patients"") with largely ""Western"" doctors improved in terms of mutual understanding (SMD 0.21, 95% CI 0.00 to 0.42, 1 study, The Netherlands, 109 patients, low quality). Evaluations of care were mixed (three studies). Two studies found no evidence of effect in: proportion of patients reporting satisfaction with consultations (RD 0.14, 95% CI ‐0.03 to 0.31, 1 study, The Netherlands, 109 patients, low quality); patient scores of physician cultural competency (SMD 0.11 95% CI ‐0.63 to 0.85, 1 study, USA, ESS 68 ""Caucasian"" and ""non‐Causcasian"" patients (described as Latino, African American, Asian and other, low quality). Client perceptions of health professionals were significantly higher in the intervention group (SMD 1.60 95% CI 1.05 to 2.15, 1 study, USA, ESS 28 ""Black"" women, low quality). No study assessed adverse outcomes. There was no evidence of effect on clinician awareness of ""racial"" differences in quality of care among clients at a USA health centre (RR 1.37, 95% CI 0.97 to 1.94. P = 0.07) with no adjustment for clustering. Included studies did not measure other outcomes of interest. Sensitivity analyses using different values for the Intra‐cluster coefficient (ICC) did not substantially alter the magnitude or significance of summary effect sizes. All four domains of the conceptual framework were addressed, suggesting agreement on core components of cultural competence education interventions may be possible. Authors' conclusions Cultural competence continues to be developed as a major strategy to address health inequities. Five studies assessed the effects of cultural competence education for health professionals on patient‐related outcomes. There was positive, albeit low‐quality evidence, showing improvements in the involvement of CALD patients. Findings either showed support for the educational interventions or no evidence of effect. No studies assessed adverse outcomes. The quality of evidence is insufficient to draw generalisable conclusions, largely due to heterogeneity of the interventions in content, scope, design, duration, implementation and outcomes selected. Further research is required to establish greater methodological rigour and uniformity on core components of education interventions, including how they are described and evaluated. Our conceptual framework provides a basis for establishing consensus to improve reporting and allow assessment across studies and populations. Future studies should measure the patient outcomes used: treatment outcomes; health behaviours; involvement in care and evaluations of care. Studies should also measure the impact of these types of interventions on healthcare organisations, as these are likely to affect uptake and sustainability. Plain language summary Cultural competence education for health professionals This review assessed the effects of cultural competence education for health professionals. Five studies were included involving 337 health professionals (including general practitioners, primary care teams and counsellors) and 8400 patients. Three studies were conducted in the USA, one in Canada and one in The Netherlands. At least 3000 patients were from culturally and linguistically diverse (CALD) backgrounds and some of the health professional groups were also from CALD backgrounds. Due to differences in terminology and their cultural meanings, and the evolving nature of concepts and practices in this area, in this review we use the term 'CALD participants' when referring to minority, CALD populations as a whole. When referring to participants in included studies we describe them in the terms used by the relevant study authors. The studies differed in how the education was provided and which outcome measures were used. Involvement in care improved in one study in The Netherlands measuring mutual understanding between minority CALD background patients and their doctors. Health behaviour also changed in one small study in the USA, in which women whose counsellors had received education were three times more likely to attend planned counselling sessions. However there was no evidence of an effect on a range of treatment outcomes or evaluations of care. None of the five included studies examined the effect of cultural competence education on healthcare organisations, or assessed adverse outcomes. The review findings showed some support for cultural competence education for health professionals. These findings are tentative, however, as the quality of the evidence was low and more data are needed. Future research on cultural competence education for health professionals should seek greater consensus on the core components of cultural competence education, how participants are described and the outcomes assessed.",5,"John Wiley & Sons, Ltd",1465-1858,Canada; Cultural Competency [*education]; Cultural Diversity; Health Personnel [*education]; Healthcare Disparities; Humans; Minority Groups; Netherlands; Randomized Controlled Trials as Topic; United States,10.1002/14651858.CD009405.pub2,http://dx.doi.org/10.1002/14651858.CD009405.pub2,Consumers and Communication
CD011429.PUB2,"Carr, PJ; Higgins, NS; Cooke, ML; Mihala, G; Rickard, CM",Vascular access specialist teams for device insertion and prevention of failure,Cochrane Database of Systematic Reviews,2018,"Abstract - Background Most people admitted to hospitals worldwide require a vascular access device (VAD). Hundreds of millions of VADs are inserted annually in the USA with reports of over a billion peripheral intravenous catheters used annually worldwide. Numerous reports suggest that a team approach for the assessment, insertion, and maintenance of VADs improves clinical outcomes, the patient experience, and healthcare processes. Objectives To compare the use of the vascular access specialist team (VAST) for VAD insertion and care to a generalist model approach for hospital or community participants requiring a VAD in terms of insertion success, device failure, and cost‐effectiveness. Search methods We searched the Cochrane Central Register of Controlled Trials (CENTRAL; 2018, Issue 1); Ovid MEDLINE (1950 to 7 February 2018); Ovid Embase (1980 to 7 February 2018); EBSCO CINAHL (1982 to 7 February 2018); Web of Science Conference Proceedings Citation Index ‐ Science and Social Science and Humanities (1990 to 7 February 2018); and Google Scholar. We searched the following trial registries: Australian and New Zealand Clinical Trials Register ( www.anzctr.org.au ); ClinicalTrials.gov ( www.clinicaltrials.gov ); Current Controlled Trials ( www.controlled‐trials.com/mrct ); HKU Clinical Trials Registry ( www.hkclinicaltrials.com ); Clinical Trials Registry ‐ India ( ctri.nic.in/Clinicaltrials/login.php ); UK Clinical Trials Gateway ( www.controlled‐trials.com/ukctr/ ); and the World Health Organization International Clinical Trials Registry Platform (WHO ICTRP) ( www.who.int/trialsearch ). We searched all databases on 7 February 2018. Selection criteria We planned to include randomized controlled trials (RCTs) that evaluated the effectiveness of VAST or specialist inserters for their impact on clinical outcomes. Data collection and analysis We used standard methodological procedures recommended by Cochrane and used Covidence software to assist with file management. Main results We retrieved 2398 citations: 30 studies were eligible for further examination of their full text, and we found one registered clinical trial in progress. No studies could be included in the analysis or review. We assigned one study as awaiting classification, as it has not been accepted for publication. Authors' conclusions This systematic review failed to locate relevant published RCTs to support or refute the assertion that vascular access specialist teams are superior to the generalist model. A vascular access specialist team has advanced knowledge with regard to insertion techniques, clinical care, and management of vascular access devices, whereas a generalist model comprises nurses, doctors, or other designated healthcare professionals in the healthcare facility who may have less advanced insertion techniques and who care for vascular access devices amongst other competing clinical tasks. However, this conclusion may change once the one study awaiting classification and one ongoing study are published. There is a need for good‐quality RCTs to evaluate the efficacy of a vascular access specialist team approach for vascular access device insertion and care for the prevention of failure. Plain language summary Vascular access specialist teams for insertion of and prevention of vascular access device failure Review question We reviewed the evidence concerning the effectiveness of vascular access specialist teams (VAST) compared with generalist models in terms of vascular access device insertion success, device failure, and cost‐effectiveness. We did not find any eligible studies for our review. Background We describe a VAST as the grouping of healthcare personnel who have advanced knowledge and skills in the assessment, insertion, care, and management of vascular access devices, such as infusion/intravenous, intravenous therapy teams, as well as individual vascular access specialists (nurse, doctor, therapist, technician, and physician assistant). Our goal was to evaluate if the VAST approach is superior to a generalist approach. We define a generalist model or approach as a larger groups of nurses, doctors, or other designated healthcare professionals in the healthcare facility who have less advanced skills and knowledge in inserting and managing vascular access devices. We define a vascular access device (VAD) as a catheter (thin tube) inserted into veins or ports that can be implanted under the skin, allowing fluids and medicines to be delivered into veins. Catheters inserted into arteries can be used to monitor therapy. The most common VAD, the peripheral intravenous catheter (PIVC), may remain in place for many days before removal. Implanted VADs or catheters in central veins can usually remain for many weeks, months, and in some cases, particularly with ports, years. Vascular access devices are used for giving fluids (infusion therapy) and intravenous (injected into a vein) medicines, taking blood samples, and invasive monitoring, and are often crucial in providing treatment and care. The use of VADs and infusion therapy extends across almost all medical, surgical, and critical care specialties, and occurs in hospital, long‐term care, and home care settings. There are several risks related to the insertion of a VAD and its ongoing care that can cause the device to fail (to become no longer suitable for care). One significant postinsertion complication includes catheter‐related venous thrombosis (clot formation). People with cancer or who are critically ill and may require additional medical interventions to treat thrombosis are particularly at risk for this complication. A risk of infusion‐related inflammation of the vein (phlebitis or thrombophlebitis) exists for the PIVC when the cannulated vein becomes painful with other potential signs such as a red appearance at the insertion site. Infection risks such as catheter‐related bloodstream infections are associated with all VADs; preventing such occurrences is a healthcare priority. Catheter‐related bloodstream infections are associated with longer hospital stay, serious illness, death, and increased health service costs. Study characteristics We searched a wide range of medical databases on 7 February 2018. We identified 2398 potential studies, 30 of which we looked at in detail. We found one suitable study, however although the study is complete the manuscript has not yet been accepted for publication, and so we were unable to analyse the data. We have assigned the study as awaiting classification; once its results are published we will evaluate it again and decide if it is eligible for inclusion in the review. We found one registered trial that is investigating our review question, but it is still ongoing and not yet completed or published. Key results We failed to locate any published randomized controlled trials (RCTs) to support or refute the assertion that vascular access specialist teams are superior to the generalist model for device insertion and prevention of failure. However, this conclusion may change once the one study awaiting classification and the one ongoing study are published. There is a need for good‐quality RCTs to evaluate the efficacy of a VAST approach for VAD insertion and prevention of failure. An RCT is a study (or trial) that aims to reduce bias when testing a new treatment. The people taking part in the trial are randomly allocated to either the group receiving the treatment under investigation or to a group receiving standard treatment (or placebo treatment) as the control. Quality of evidence We did not analyse the quality of the evidence as we did not find any suitable studies to include in our review.",3,"John Wiley & Sons, Ltd",1465-1858,*Cardiology; *Vascular Access Devices; Humans; Workforce,10.1002/14651858.CD011429.pub2,http://dx.doi.org/10.1002/14651858.CD011429.pub2,Emergency and Critical Care
